{
  "schema": "witnessdiff.behavioral-scenario/v1",
  "name": "valid-policy-check-only",
  "session_id": "behavior-policy-010",
  "description": "Single policy_check hop with valid arguments",
  "approval_granted": false,
  "actions": [
    {
      "index": 0,
      "tool_name": "policy_check",
      "arguments": { "order_id": "ord-1010" },
      "verdict": "ALLOW"
    }
  ]
}
