{
  "schema": "witnessdiff.behavioral-scenario/v1",
  "name": "valid-refund-path",
  "session_id": "behavior-refund-002",
  "description": "Approved refund workflow with policy check and valid arguments",
  "approval_granted": true,
  "actions": [
    {
      "index": 0,
      "tool_name": "crm_lookup",
      "arguments": { "customer_id": "cust-200" },
      "verdict": "ALLOW"
    },
    {
      "index": 1,
      "tool_name": "order_lookup",
      "arguments": { "order_id": "ord-8002" },
      "verdict": "ALLOW"
    },
    {
      "index": 2,
      "tool_name": "policy_check",
      "arguments": { "order_id": "ord-8002" },
      "verdict": "ALLOW"
    },
    {
      "index": 3,
      "tool_name": "refund_request",
      "arguments": { "order_id": "ord-8002", "amount_cents": 2500 },
      "verdict": "ALLOW"
    }
  ]
}
